{
  "$schema": "s2a-grid-defs/1",
  "slug": "column-grid",
  "name": "Column grid",
  "version": "1.0.0",
  "kind": "grid",
  "tier": "sectional",
  "status": "shipped",
  "description": "The column-span system: children of a row declare how many columns they occupy, and optionally which column they start at, per breakpoint range. Width is column-based — you say 'eight of twelve', not '931px'. This is the first of three grid kinds in the system, and the one most layouts should use. Figma calls it Column flex-Grid-8.",
  "anchors": {
    "code": { "stylesheet": "packages/grid/src/s2a-layout-grids.css", "importPath": "@adobecom/s2a-grid/css/grid.css", "rootClass": "row", "childClass": "col-lg-8" },
    "figma": { "collectionId": "VariableCollectionId:6:178", "fileKey": "qAF4nlt6O4ThbeXeO7jzdb", "nodeId": "104:26144", "layerName": "Column flex-Grid-8", "designOnly": true }
  },
  "breakpointBehavior": [
    { "breakpoint": "sm", "behavior": "col-sm-1 through col-sm-6 against a 6-column grid. Declared at the top level, so they are the mobile-first base.", "columns": 6 },
    { "breakpoint": "md", "behavior": "col-md-1 through col-md-12 override col-lg-* inside the tablet range, for layouts that need a different stack at tablet.", "columns": 12 },
    { "breakpoint": "lg", "behavior": "col-lg-1 through col-lg-12 re-declared at 1280 so they win back over col-md-*.", "columns": 12 },
    { "breakpoint": "xl", "behavior": "Inherits the lg spans; HD changes the container, not the column count.", "columns": 12 }
  ],
  "tokens": [{ "role": "gutter", "ref": "{s2a.spacing.xs}", "breakpoint": "all" }],
  "surface": {
    "classes": [
      { "name": "col-sm-1", "purpose": "Span one of six at mobile.", "pattern": "col-sm-{1..6}" },
      { "name": "col-sm-full", "purpose": "Span the whole row at mobile, whatever the column count." },
      { "name": "col-md-6", "purpose": "Span six of twelve in the tablet range.", "pattern": "col-md-{1..12}" },
      { "name": "col-md-full", "purpose": "Span the whole row in the tablet range." },
      { "name": "col-lg-8", "purpose": "Span eight of twelve from 768 up, re-asserted at 1280.", "pattern": "col-lg-{1..12}" },
      { "name": "col-lg-full", "purpose": "Span the whole row from 768 up." },
      { "name": "start-sm-2", "purpose": "Start at a named column at mobile.", "pattern": "start-sm-{1..6}" },
      { "name": "start-md-4", "purpose": "Start at a named column in the tablet range.", "pattern": "start-md-{1..12}" },
      { "name": "start-lg-5", "purpose": "Start at a named column from 768 up — this is how an asymmetric layout is expressed without an empty spacer div.", "pattern": "start-lg-{1..12}" }
    ]
  },
  "rules": [
    { "id": "COL_ROW_REQUIRED", "statement": "Column classes only mean anything inside a row; the row is what creates the grid they span.", "severity": "fail", "check": { "type": "classPresent", "name": "row" } },
    { "id": "COL_SM_FULL_SET", "statement": "The mobile range offers a span for every one of its six columns.", "severity": "fail", "check": { "type": "classPresent", "name": "col-sm-6" } },
    { "id": "COL_SM_NO_7", "statement": "The mobile range stops at six. A col-sm-7 would be a span wider than the grid it sits in.", "severity": "fail", "check": { "type": "classAbsent", "name": "col-sm-7" } },
    { "id": "COL_LG_FULL_SET", "statement": "The desktop range offers a span for every one of its twelve columns.", "severity": "fail", "check": { "type": "classPresent", "name": "col-lg-12" } },
    { "id": "COL_MD_FULL_SET", "statement": "The tablet range offers a span for every one of its twelve columns.", "severity": "fail", "check": { "type": "classPresent", "name": "col-md-12" } },
    { "id": "COL_NO_13", "statement": "No range offers a thirteenth column.", "severity": "fail", "check": { "type": "classAbsent", "name": "col-lg-13" } },
    { "id": "COL_START_LG", "statement": "Explicit column starts exist for the desktop range, so asymmetric layouts need no spacer elements.", "severity": "fail", "check": { "type": "classPresent", "name": "start-lg-5" } },
    { "id": "COL_START_MD", "statement": "Explicit column starts exist for the tablet range.", "severity": "fail", "check": { "type": "classPresent", "name": "start-md-5" } },
    { "id": "COL_MD_AFTER_LG", "statement": "col-md-* must be declared after col-lg-* inside the 768 range, or the tablet override never wins. Source order is load-bearing here.", "severity": "fail", "check": { "type": "manual", "note": "Both families sit in the same @media (min-width: 768px) block with col-md-* second; the 1280 block then re-asserts col-lg-*. Confirmed by reading the stylesheet; a cascade check would need a real CSS cascade model." } },
    { "id": "COL_GUTTER_FIGMA", "statement": "The gutter between columns is the same 8px Figma's layout guide uses.", "severity": "fail", "check": { "type": "figmaAgrees", "figmaPath": "layout-guide.gap", "mode": "lg", "expected": 8 } }
  ],
  "decisions": [
    {
      "id": "COL_ROW_SPAN_PAIRING",
      "question": "row-span-* utilities exist for all three ranges but only do anything inside a bento grid, where rows have a fixed height. Should they move to the bento contract or stay general?",
      "state": "open",
      "owner": "Matthew Huntsberry",
      "evidence": "In a plain .row the rows are content-sized, so grid-row: span 2 has no predictable effect. They are documented under bento-grid for now."
    }
  ],
  "visualize": {
    "demo": "columns",
    "overlay": true,
    "spans": [[12], [6, 6], [8, 4], [4, 4, 4], [3, 3, 3, 3], [7, 5], [9, 3], [2, 8, 2]],
    "note": "Each row is a real .row with real col-lg-* children, so what you see is the stylesheet, not a drawing of it."
  }
}
