{
  "$schema": "s2a-grid-defs/1",
  "slug": "bento-grid",
  "name": "Bento grid",
  "version": "1.0.0",
  "kind": "grid",
  "tier": "sectional",
  "status": "shipped",
  "description": "A modular grid with fixed-height rows and dense packing: children declare both a column span and a row span, and the browser backfills gaps. For tile walls and bento sections where cards are deliberately different sizes. The fixed row height is what makes row spans predictable — in a normal row, rows are content-sized and a row span means nothing.",
  "anchors": {
    "code": { "stylesheet": "packages/grid/src/s2a-layout-grids.css", "importPath": "@adobecom/s2a-grid/css/grid.css", "rootClass": "bento-grid", "childClass": "row-span-lg-2" },
    "figma": { "collectionId": "VariableCollectionId:6:178", "layerName": "UPS grid", "designOnly": true }
  },
  "breakpointBehavior": [
    { "breakpoint": "sm", "behavior": "6 columns, 120px rows, dense packing. row-span-sm-* applies.", "columns": 6 },
    { "breakpoint": "md", "behavior": "12 columns, 120px rows. row-span-md-* overrides row-span-lg-* in this range.", "columns": 12 },
    { "breakpoint": "lg", "behavior": "12 columns, 120px rows. row-span-lg-* re-asserted at 1280.", "columns": 12 },
    { "breakpoint": "xl", "behavior": "Inherits lg. The tiles grow with the container, not the row height.", "columns": 12 }
  ],
  "tokens": [{ "role": "gutter", "ref": "{s2a.spacing.xs}", "breakpoint": "all" }],
  "surface": {
    "classes": [
      { "name": "bento-grid", "purpose": "Dense-packed modular grid with fixed row height." },
      { "name": "row-span-sm-2", "purpose": "Occupy two rows at mobile.", "pattern": "row-span-sm-{1..12|full}" },
      { "name": "row-span-md-2", "purpose": "Occupy two rows in the tablet range.", "pattern": "row-span-md-{1..12|full}" },
      { "name": "row-span-lg-2", "purpose": "Occupy two rows from 768 up.", "pattern": "row-span-lg-{1..12|full}" }
    ],
    "customProperties": [{ "name": "--s2a-grid-row-height", "purpose": "The fixed row height, 120px. The one number in the grid system that is not yet a token." }]
  },
  "rules": [
    { "id": "BENTO_CLASS", "statement": "The bento grid class exists.", "severity": "fail", "check": { "type": "classPresent", "name": "bento-grid" } },
    { "id": "BENTO_ROW_HEIGHT", "statement": "Rows are a fixed 120px, which is what makes a row span mean something.", "severity": "fail", "check": { "type": "customPropertyEquals", "name": "--s2a-grid-row-height", "media": null, "expectedPx": 120 } },
    { "id": "BENTO_DENSE", "statement": "Packing is dense, so a short tile backfills a hole left by a tall one instead of leaving a gap.", "severity": "fail", "check": { "type": "declarationEquals", "class": "bento-grid", "media": null, "property": "grid-auto-flow", "expectedValue": "dense" } },
    { "id": "BENTO_SPANS_SM", "statement": "Row spans exist for the mobile range.", "severity": "fail", "check": { "type": "classPresent", "name": "row-span-sm-2" } },
    { "id": "BENTO_SPANS_MD", "statement": "Row spans exist for the tablet range.", "severity": "fail", "check": { "type": "classPresent", "name": "row-span-md-2" } },
    { "id": "BENTO_SPANS_LG", "statement": "Row spans exist for the desktop range.", "severity": "fail", "check": { "type": "classPresent", "name": "row-span-lg-2" } },
    {
      "id": "BENTO_ROW_HEIGHT_TOKEN",
      "statement": "The row height should be a semantic token like every other dimension in the grid, not a literal in the stylesheet.",
      "severity": "warn",
      "check": { "type": "tokenShipped", "ref": "{s2a.grid.row-height}" }
    }
  ],
  "decisions": [
    {
      "id": "BENTO_ROW_HEIGHT_RESPONSIVE",
      "question": "Should the 120px row height change per breakpoint? It is currently fixed at every range, so a two-row tile is 248px tall on a phone and on a 2560 display.",
      "state": "open",
      "owner": "Matthew Huntsberry",
      "evidence": "The Bento component and its visual eval pass at 120px today (10/10 within 8%), so this is a question about the general grid rather than a defect in the shipped component."
    }
  ],
  "visualize": { "demo": "bento", "overlay": false, "note": "Tiles carry both a column span and a row span; the dense packing is visible where a small tile backfills." }
}
